<?xml version="1.0"?>

<transmogrifierConfiguration xmlns:xsi="http://www.w3.org/2001/XMLSchema-instance"
                     xsi:noNamespaceSchemaLocation="transmogrifier_config.xsd">

    <global minimumVersion="3.0.7" frameSizePercentage="95"/>

    <project name="Fly Light: Dickson Images (BJD_*)" default="true">

        <inputFileSorter sortAlgorithm="LNumber" />

        <outputDirectory basePath="[\\dm11.janelia.priv|/groups/flylight]/flylight/dickson/confocalStacks"
                         derivedFromEarliestModifiedFile="true"/>

        <plugins>

            <rowValidator className="org.janelia.it.wip.WipDataPlugin">
                <property name="batchNameFieldName" value="Batch Name"/>
                <property name="batchNumberFieldName" value="Batch Number"/>
                <property name="batchColorFieldName" value="Batch Color"/>
            </rowValidator>

            <rowListener className="org.janelia.it.wip.WipDataPlugin">
                <property name="batchNameFieldName" value="Batch Name"/>
                <property name="batchNumberFieldName" value="Batch Number"/>
                <property name="batchColorFieldName" value="Batch Color"/>
            </rowListener>

            <rowListener className="org.janelia.it.ims.tmog.plugin.imagedb.ImageDataPlugin">
                <property name="db.config.key" value="sage"/>
                <property name="lab" value="$STATIC:dickson"/>
                <property name="family" value="$STATIC:dickson"/>
                <property name="imaging_project" value="$STATIC:broad_expression_patterns"/>
                <property name="effector" value="UAS Reporter"/>
                <property name="line" value="Line"/>
                <property name="created_by" value="Imager"/>
                <property name="renamed_by" value="Renamer"/>
                <property name="class" value="Class"/>
                <property name="ihc_batch" value="Batch Name"/>
                <property name="mounting_protocol" value="Tissue Mounting Protocol"/>
                <property name="tissue_orientation" value="Tissue Orientation"/>
            </rowListener>

        </plugins>

        <dataFields>

            <!-- lines should all start with BJD -->
            <webServiceList displayName="Line" required="true"
                            valueCreationPath="*/line"
                            relativeActualValuePath="name"
                            relativeValueDisplayNamePath="name"
                            serviceUrl="http://sage.int.janelia.org/sage-ws/lines/forMultipleLabs.janelia-sage?lab=dickson"
                            autoComplete="true">
            </webServiceList>

            <separator value="_00-"/>

            <validValueList displayName="Gender" required="true">
                <validValue displayName="m: Male" value="m"/>
                <validValue displayName="f: Female" value="f"/>
                <validValue displayName="x: Not Defined" value="x"/>
            </validValueList>

            <validValueList displayName="Age" required="true">
                <validValue displayName="X00: undefined" value="X00"/>
                <validValue displayName="P01: Prepupa" value="P01"/>
                <validValue displayName="P02: Pupa" value="P02"/>
                <validValue displayName="E01: Embryonic Stage 1" value="E01"/>
                <validValue displayName="E02: Embryonic Stage 2" value="E02"/>
                <validValue displayName="E03: Embryonic Stage 3" value="E03"/>
                <validValue displayName="E04: Embryonic Stage 4" value="E04"/>
                <validValue displayName="E05: Embryonic Stage 5" value="E05"/>
                <validValue displayName="E06: Embryonic Stage 6" value="E06"/>
                <validValue displayName="E07: Embryonic Stage 7" value="E07"/>
                <validValue displayName="E08: Embryonic Stage 8" value="E08"/>
                <validValue displayName="E09: Embryonic Stage 9" value="E09"/>
                <validValue displayName="E10: Embryonic Stage 10" value="E10"/>
                <validValue displayName="E11: Embryonic Stage 11" value="E11"/>
                <validValue displayName="E12: Embryonic Stage 12" value="E12"/>
                <validValue displayName="E13: Embryonic Stage 13" value="E13"/>
                <validValue displayName="E14: Embryonic Stage 14" value="E14"/>
                <validValue displayName="E15: Embryonic Stage 15" value="E15"/>
                <validValue displayName="E16: Embryonic Stage 16" value="E16"/>
                <validValue displayName="E17: Embryonic Stage 17" value="E17"/>
                <validValue displayName="L01: First Instar" value="L01"/>
                <validValue displayName="L02: Second Instar" value="L02"/>
                <validValue displayName="L03: Third Instar" value="L03"/>
                <validValue displayName="A01: Day 1-5" value="A01"/>
                <validValue displayName="A02: Day 6-10" value="A02"/>
                <validValue displayName="A03: Day 11-15" value="A03"/>
                <validValue displayName="A04: Day 16-20" value="A04"/>
                <validValue displayName="A05: Day 21-25" value="A05"/>
                <validValue displayName="A06: Day 26-30" value="A06"/>
            </validValueList>

            <validValueList displayName="Area" required="true">
                <validValue displayName="s: Salivary Gland" value="s"/>
                <validValue displayName="b: Brain" value="b"/>
                <validValue displayName="v: Ventral Nerve Cord" value="v"/>
            </validValueList>

            <separator value="_C"/>
            <fileModificationTime displayName="Capture Date" datePattern="yyMMdd" />
            <separator value="_"/>
            <runTime datePattern="yyyyMMddHHmmssSSS"/>
            <separator value=".lsm"/>

            <!--
             These values are collected for the SAGE database but are not
             included as components of the file name (markedForTask="false").
             -->
            <number displayName="Batch Number" required="true"
                    minimumValue="80" maximumValue="600"
                    markedForTask="false" />

            <validValueList displayName="Batch Color" required="true"
                            markedForTask="false">
                <validValue value="red"/>
                <validValue value="tan"/>
                <validValue value="purple"/>
                <validValue value="blue"/>
                <validValue value="white"/>
                <validValue value="pink"/>
                <validValue value="gray"/>
                <validValue value="green"/>
                <validValue value="yellow"/>
                <validValue value="orange"/>
            </validValueList>

            <pluginData displayName="Batch Name" markedForTask="false" />

            <validValueList displayName="Tissue Mounting Protocol" required="true"
                            markedForTask="false">
                <validValue value="Glycerol-Based Mounting" default="true"/>
                <validValue value="DPX Mounting"/>
            </validValueList>

            <cvTermList displayName="Tissue Orientation" required="true"
                        markedForTask="false"
                        serviceUrl="http://sage.int.janelia.org/sage-ws/cvs/tissue_orientation"
                        displayNamePrefixedForValues="false">
                <staticDefault value="face_up"/>
            </cvTermList>

            <validValueList displayName="UAS Reporter" required="true"
                            markedForTask="false">
                <validValue value="UAS_IVS-mCD8_3_0007" default="true"/>
                <validValue value="UAS_mCD8_2_0006"/>
                <validValue value="LexAop_IVS-myr_3_0008"/>
            </validValueList>

            <cvTermList displayName="Imager" required="true"
                        markedForTask="false"
                        autoComplete="true"
                        serviceUrl="http://sage.int.janelia.org/sage-ws/cvs/imager">
            </cvTermList>

            <cvTermList displayName="Renamer" required="true"
                        markedForTask="false"
                        autoComplete="true"
                        serviceUrl="http://sage.int.janelia.org/sage-ws/cvs/imager"
                        sharedForAllSessionFiles="true">
            </cvTermList>

            <validValueList displayName="Class" required="false"
                            markedForTask="false">
                <validValue displayName="Screening" value="Screening" default="true"/>
                <validValue displayName="Rework" value="Rework"/>
            </validValueList>

        </dataFields>

    </project>

</transmogrifierConfiguration>